{
  "graph_version": "0.0.1",
  "last_updated": "2026-10-24",
  "description": "Typed skill graph for the salmon scaffold. Seed candidate lanes lexically or semantically, normalize the entities, then expand through typed skill, platform, and governance edges while respecting access tiers and scaffold boundaries.",
  "nodes": [
    {
      "id": "skill:salmon-research-router-skill",
      "type": "skill",
      "label": "salmon-research-router-skill",
      "description": "Default router for broad salmon ecology, conservation, and management-science questions.",
      "entrypoint": "skills/salmon-research-router-skill/SKILL.md",
      "role": "router",
      "input_contract": "Broad, ambiguous, or multi-source salmon questions.",
      "lane_tags": [
        "lane:stock-assessment",
        "lane:crosswalk-harmonization",
        "lane:telemetry-passage",
        "lane:watershed-connectivity",
        "lane:hatchery-harvest-management",
        "lane:coded-wire-tag-recovery",
        "lane:genetics-stock-identification",
        "lane:climate-ocean-context",
        "lane:ontology-semantic-resolution",
        "lane:literature-reports-dataset-discovery",
        "lane:package-metadata-validation"
      ],
      "selection_note": "Seed 1 to 3 lanes, then expand to the smallest defensible connected subgraph."
    },
    {
      "id": "skill:salmon-entity-normalizer-skill",
      "type": "skill",
      "label": "salmon-entity-normalizer-skill",
      "description": "Seed normalization layer for salmon entities, aliases, and management-unit systems.",
      "entrypoint": "skills/salmon-entity-normalizer-skill/SKILL.md",
      "role": "normalizer",
      "input_contract": "Species aliases, jurisdictions, management-unit systems, and common identifier tokens.",
      "lane_tags": [
        "lane:stock-assessment",
        "lane:crosswalk-harmonization",
        "lane:telemetry-passage",
        "lane:watershed-connectivity",
        "lane:hatchery-harvest-management",
        "lane:coded-wire-tag-recovery",
        "lane:genetics-stock-identification",
        "lane:climate-ocean-context",
        "lane:ontology-semantic-resolution",
        "lane:literature-reports-dataset-discovery"
      ],
      "selection_note": "Use early, but do not treat this as an authoritative production identity graph."
    },
    {
      "id": "skill:salmon-terms",
      "type": "skill",
      "label": "salmon-terms",
      "description": "Term search through metasalmonpy's find_terms() and sources_for_role() at the pinned v0.6.0 release, across smn, gcdfo, and external vocabularies.",
      "entrypoint": "skills/salmon-terms/SKILL.md",
      "role": "semantic",
      "input_contract": "Salmon concepts, semantic roles, and optional source lists; returns ranked term IRIs, labels, definitions, and per-source diagnostics.",
      "lane_tags": [
        "lane:ontology-semantic-resolution",
        "lane:package-metadata-validation"
      ],
      "selection_note": "For DFO-specific requests keep gcdfo in the sources; the package ranks smn above gcdfo, so shared terms still come first."
    },
    {
      "id": "skill:metasalmon-skill",
      "type": "skill",
      "label": "metasalmon-skill",
      "description": "Thin adapter to metasalmonpy v0.6.0 for Salmon Data Package validation, ontology fetch, and the semantic review-packet round trip, with metasalmon in R documented as the alternative.",
      "entrypoint": "skills/metasalmon-skill/SKILL.md",
      "role": "package",
      "input_contract": "Salmon Data Package validation, ontology file fetch, review-packet build and ingest, and package runtime checks.",
      "lane_tags": [
        "lane:package-metadata-validation"
      ]
    },
    {
      "id": "skill:sdp-semantic-review",
      "type": "skill",
      "label": "sdp-semantic-review",
      "description": "Judges a Salmon Data Package's semantic review packet in the harness: chooses among each slot's ontology candidates by index, and writes the answers through metasalmon-skill's adapter for metasalmonpy v0.6.0 to ingest, validate, and record.",
      "entrypoint": "skills/sdp-semantic-review/SKILL.md",
      "role": "semantic",
      "input_contract": "A Salmon Data Package path or an existing semantic-review-packet.json, with optional context documents; returns the recorded verdicts and the calls the user runs to confirm them.",
      "lane_tags": [
        "lane:package-metadata-validation",
        "lane:ontology-semantic-resolution"
      ]
    },
    {
      "id": "skill:streamnet-api-skill",
      "type": "skill",
      "label": "streamnet-api-skill",
      "description": "Narrow StreamNet REST wrapper for coordinated assessment and related metadata.",
      "entrypoint": "skills/streamnet-api-skill/SKILL.md",
      "role": "source",
      "input_contract": "Coordinated Assessment table listings, schemas, and record retrieval.",
      "lane_tags": [
        "lane:stock-assessment",
        "lane:watershed-connectivity"
      ]
    },
    {
      "id": "skill:ptagis-skill",
      "type": "skill",
      "label": "ptagis-skill",
      "description": "Narrow PTAGIS wrapper for telemetry observations, site codes, and metadata surfaces.",
      "entrypoint": "skills/ptagis-skill/SKILL.md",
      "role": "source",
      "input_contract": "PIT-tag observations, site-code listings, report metadata, and validation codes.",
      "lane_tags": [
        "lane:telemetry-passage"
      ]
    },
    {
      "id": "skill:rmis-skill",
      "type": "skill",
      "label": "rmis-skill",
      "description": "Authenticated RMIS and RMPC API wrapper plus public RMIS status lookups.",
      "entrypoint": "skills/rmis-skill/SKILL.md",
      "role": "source",
      "input_contract": "Coded-wire-tag release, recovery, location, and catch-sample queries.",
      "lane_tags": [
        "lane:coded-wire-tag-recovery",
        "lane:hatchery-harvest-management"
      ]
    },
    {
      "id": "skill:dart-query-skill",
      "type": "skill",
      "label": "dart-query-skill",
      "description": "Catalog and fetch helper for important Columbia River DART query surfaces.",
      "entrypoint": "skills/dart-query-skill/SKILL.md",
      "role": "source",
      "input_contract": "Catalog lookups and important DART page fetches by short name or path.",
      "lane_tags": [
        "lane:telemetry-passage",
        "lane:watershed-connectivity"
      ]
    },
    {
      "id": "skill:salmon-literature-skill",
      "type": "skill",
      "label": "salmon-literature-skill",
      "description": "PubMed-backed literature search and article summary skill for salmon topics.",
      "entrypoint": "skills/salmon-literature-skill/SKILL.md",
      "role": "literature",
      "input_contract": "Free-text salmon research questions, literature discovery, and compact article summaries.",
      "lane_tags": [
        "lane:stock-assessment",
        "lane:watershed-connectivity",
        "lane:hatchery-harvest-management",
        "lane:genetics-stock-identification",
        "lane:climate-ocean-context",
        "lane:literature-reports-dataset-discovery"
      ]
    },
    {
      "id": "skill:critfc-crosswalk-skill",
      "type": "skill",
      "label": "critfc-crosswalk-skill",
      "description": "Public CRITFC crosswalk and ArcGIS REST wrapper for Columbia Basin pop or unit reconciliation context.",
      "entrypoint": "skills/critfc-crosswalk-skill/SKILL.md",
      "role": "source",
      "input_contract": "CRITFC crosswalk page reads, REST-root fetches, and bounded public request passthroughs.",
      "lane_tags": [
        "lane:crosswalk-harmonization"
      ]
    },
    {
      "id": "skill:noaa-sps-skill",
      "type": "skill",
      "label": "noaa-sps-skill",
      "description": "Public NOAA Salmon Population Summary page and help-doc wrapper for recovery-planning context.",
      "entrypoint": "skills/noaa-sps-skill/SKILL.md",
      "role": "source",
      "input_contract": "SPS home/help page reads and bounded public request passthroughs.",
      "lane_tags": [
        "lane:stock-assessment"
      ]
    },
    {
      "id": "skill:npafc-skill",
      "type": "skill",
      "label": "npafc-skill",
      "description": "Public NPAFC CKAN catalogue and statistics wrapper for North Pacific dataset discovery and time-series context.",
      "entrypoint": "skills/npafc-skill/SKILL.md",
      "role": "source",
      "input_contract": "Dataset search/show, resource metadata, statistics page reads, and bounded public requests.",
      "lane_tags": [
        "lane:literature-reports-dataset-discovery"
      ]
    },
    {
      "id": "skill:salmon-stock-brief-workflow-skill",
      "type": "skill",
      "label": "salmon-stock-brief-workflow-skill",
      "description": "Composite workflow scaffold for structured salmon stock briefs with fixed provenance-aware output sections.",
      "entrypoint": "skills/salmon-stock-brief-workflow-skill/SKILL.md",
      "role": "workflow",
      "input_contract": "Requests for structured stock briefs or reusable brief contracts over existing evidence lanes.",
      "lane_tags": [
        "lane:stock-assessment"
      ],
      "selection_note": "Use when the user explicitly asks for a structured stock brief rather than raw retrieval."
    },
    {
      "id": "skill:commons-card",
      "type": "skill",
      "label": "commons-card",
      "description": "Writes and checks salmon knowledge commons cards with the commons' own validator and citation-ledger tools, run at a pinned commons commit against the user's clone; holds no checks of its own.",
      "entrypoint": "skills/commons-card/SKILL.md",
      "role": "knowledge",
      "input_contract": "A clone of the commons, card paths, and citation-ledger JSON files; returns the validator's findings, the in-card ledger sections, the card-only check, and CONTRIBUTING.md at the pin."
    },
    {
      "id": "platform:streamnet",
      "type": "platform",